{
  "contract_version": "w02-0.1.0-draft",
  "scope_id": "qinghe",
  "origin": "live",
  "meeting_id": "32ff5258-64f5-5f96-b22c-a1e2dca7d697",
  "week": 1,
  "role_id": "ROLE-SHEN",
  "scenario_version": "w01-scenario-0.3.2",
  "purpose": "确认复购率在青禾经营指标中的位置、三个月\"可核对进展\"的具体标准，以及小范围验证的决策与数据授权条件，为立项判断的验收口径和推进条件提供依据。",
  "state": "active",
  "messages": [
    {
      "id": "MSG-01189",
      "speaker": "assistant",
      "content": "又见面了，这次你们想接着问什么？"
    },
    {
      "id": "MSG-01190",
      "speaker": "user",
      "content": "沈总好，上次您提到要看重点够不够实，这次想就三件事再确认一下：验收看什么、可核对的进展怎么算、下一步谁来拍板。先问第一个：复购率在青禾的经营指标里是什么位置？是收入或利润上的压力让您关注它，还是它本来就是您一直在跟踪的指标？"
    },
    {
      "id": "MSG-01191",
      "speaker": "assistant",
      "content": "复购率是我一直盯着的核心指标，连续四个季度下滑，直接关系到会员这块的收入。我找你们做会员运营助手，就是要让它止跌回升；具体提升幅度和计算口径还没定，得把依据和范围谈清楚。"
    },
    {
      "id": "MSG-01192",
      "speaker": "user",
      "content": "明白。您说三个月内要看到分层、触达和复购变化上可核对的进展。如果先在部分门店的数据上，做出一份有依据、能逐个核对的重点会员名单，这算不算您要的进展？还差什么？"
    },
    {
      "id": "MSG-01193",
      "speaker": "assistant",
      "content": "算，这就是我要的那种进展：名单能落到具体会员、逐条说得清依据，比空谈方案强。但还差两样：一是名单背后的数据口径得跟相关同事核实，我现在不能确认数据支不支持会员老化这个判断；二是三个月要看到复购变化，名单只是起点，触达和复购怎么算得先谈清楚。"
    },
    {
      "id": "MSG-01194",
      "speaker": "user",
      "content": "明白，名单作为起点，触达和复购的算法后面一起谈。如果先选几家门店、一段时间的数据做小范围验证，范围由您定，还是要和其他人一起定？会员和订单数据提供给我们做验证，需要谁批准，有没有合规要求？"
    },
    {
      "id": "MSG-01195",
      "speaker": "assistant",
      "content": "验证范围我定不了全部，得跟运营和门店一起看，小林、陈姐要参与。会员和订单数据给你们做验证，具体谁批、走什么合规流程，我现在不能确认，得找老周和王经理核实；预算和合同这块也要王经理参与。"
    },
    {
      "id": "MSG-01196",
      "speaker": "user",
      "content": "明白，范围和小林、陈姐一起定，数据授权和合规找老周、王经理核实。最后一个问题：三个月是从什么时候开始算？中间有没有固定的董事会汇报节点？"
    },
    {
      "id": "MSG-01197",
      "speaker": "assistant",
      "content": "我希望三个月能看到效果，董事会那里也需要有个交代。"
    },
    {
      "id": "MSG-01198",
      "speaker": "user",
      "content": "理解。想确认一下起算点，因为会影响我们排计划：这三个月您希望从立项开始算，还是从数据和范围确认、验证开始之后算？"
    },
    {
      "id": "MSG-01199",
      "speaker": "assistant",
      "content": "三个月是我希望看到效果的时间，不是从哪天起算的正式约定。真排计划，我倾向从数据和范围确认、验证能跑起来之后算，这样三个月看的是实打实的进展。具体起算点和中间汇报节点，得跟小林、陈姐、王经理他们对齐，我现在不能拍死。"
    },
    {
      "id": "MSG-01200",
      "speaker": "user",
      "content": "谢谢沈总，我复述一下这次的理解：复购率是您一直盯着的核心指标，关系到会员收入，提升幅度和口径还要一起定。在部分门店数据上做出能逐条核对依据的重点会员名单，算是您要的进展，但数据口径要核实，触达和复购怎么算也要先谈清楚。验证范围要和小林、陈姐一起定，数据授权、合规和预算找老周、王经理核实。三个月是您期望看到效果的时间，不是正式约定，您倾向从数据和范围确认、验证跑起来之后起算，具体起算点和汇报节点还要和大家对齐。接下来我们按这些整理判断和核实计划。有理解不对的地方请您指正。"
    },
    {
      "id": "MSG-01201",
      "speaker": "assistant",
      "content": "复述得基本对，没有要纠正的地方。复购率是我一直盯的核心指标，要的是止跌回升；名单能逐条核对依据，算我要的进展。数据口径、触达和复购怎么算还没定，得跟小林、陈姐、老周、王经理他们对齐，起算点也一样。你们按这个整理核实计划，我这边看的是能不能尽快跑出实打实的东西。"
    }
  ]
}