{
  "contract_version": "w02-0.1.0-draft",
  "scope_id": "qinghe",
  "origin": "live",
  "meeting_id": "297d91ea-0cee-51bb-b5b5-1042ea54f86f",
  "week": 1,
  "role_id": "ROLE-SHEN",
  "scenario_version": "w01-scenario-0.3.2",
  "purpose": "弄清沈总对项目\"效果\"的期望，以及关键数字的出处，为立项判断和下一步找谁核实提供依据。\n\n",
  "state": "active",
  "messages": [
    {
      "id": "MSG-01178",
      "speaker": "assistant",
      "content": "你先说说，这次准备了解什么，以及怎么判断这个产品能帮到我们。"
    },
    {
      "id": "MSG-01179",
      "speaker": "user",
      "content": "三个月后，您希望向董事会展示的是什么？如果那时复购率还没明显回升，什么样的进展您会觉得这个项目值得继续？"
    },
    {
      "id": "MSG-01180",
      "speaker": "assistant",
      "content": "三个月后我最想向董事会展示的是复购率止跌回升，这个项目就是冲着这个结果去的。至于具体提升多少、按什么口径算、什么算正式验收，现在都还没确认，得把依据和范围谈清楚。如果到时还没明显回升，至少得让我看到会员分层、触达和复购变化有可核对的进展，而不是只讲产品功能。"
    },
    {
      "id": "MSG-01181",
      "speaker": "user",
      "content": "先补答您刚才的问题：这次主要想弄清您期望的效果，以及关键数据从哪来，据此判断产品哪部分能先验证、哪部分需要青禾配合。您提到复购率连续四个季度下滑、80 万活跃会员，这两个数一般是看哪份报表？是哪个团队在统计？"
    },
    {
      "id": "MSG-01182",
      "speaker": "assistant",
      "content": "复购率连续四个季度下滑、80万活跃会员，是我们目前按这个口径看的，具体报表和统计团队我现在不能确认，得跟相关同事核实。会员老化也只是我的判断，数据支不支持还要看核实结果。运营找小林、门店情况找陈姐，数据口径这块你们可以一并问清楚。"
    },
    {
      "id": "MSG-01183",
      "speaker": "user",
      "content": "明白，口径我们会分别找小林和老周核实。您邮件里提到\"别让小林再多整理一套表\"，是上个项目出现过这种情况吗？当时具体是怎么回事？"
    },
    {
      "id": "MSG-01184",
      "speaker": "assistant",
      "content": "邮件里那句话，是我对上次智能营销项目的看法——我认为是供应商没交付好，所以这次不想再让小林多背一套整理表的活。但当时具体出了什么技术问题、怎么用的、效果如何，我现在给不了可确认的细节，别拿我的印象当事实。"
    },
    {
      "id": "MSG-01185",
      "speaker": "user",
      "content": "好的，上个项目的情况我们之后找小林和老周了解。最后想确认两件事：这个项目的预算目前是什么状态，是已经批了，还是需要我们先出方案再走审批？另外，后续找老周、小林、陈姐了解情况，方便您先跟他们打个招呼吗？"
    },
    {
      "id": "MSG-01186",
      "speaker": "assistant",
      "content": "预算这块我现在给不了确定状态，金额、具体审批流程和要多久都还没核实，不能承诺已经批了或什么时候能走完；预算和合同的事要王经理一起参与。找人了解情况没问题，老周、小林、陈姐这几位我会跟他们说一声，但具体约到什么时候得看他们各自的安排。"
    },
    {
      "id": "MSG-01187",
      "speaker": "user",
      "content": "谢谢沈总，我复述一下确认理解：您的目标是复购率止跌回升，但提升幅度、口径和验收标准还要一起确定；三个月内至少要看到会员分层、触达和复购变化上可核对的进展。两个关键数字的出处、会员老化的判断、上个项目的情况，我们分别找小林和老周核实；预算请王经理一起看。接下来我们先整理一份判断和核实计划给您。有理解不对的地方请您指正。"
    },
    {
      "id": "MSG-01188",
      "speaker": "assistant",
      "content": "理解基本对，目标就是复购率止跌回升，提升幅度、口径和验收标准都还没定，得一起谈清楚。三个月内我要看到会员分层、触达和复购变化上有可核对的进展，不是只讲功能。核实这块，数据口径和会员老化找小林，系统问题找老周，预算和合同要王经理参与。你们先整理判断和核实计划，我看重点够不够实。"
    }
  ]
}