{
  "contract_version": "w02-0.1.0-draft",
  "scope_id": "qinghe",
  "origin": "live",
  "meeting_id": "1360cd40-3972-5f00-8d48-e03f16ae2487",
  "week": 2,
  "role_id": "ROLE-SHEN",
  "scenario_version": "w02-scenario-0.1.3",
  "purpose": "向沈总说明本周访谈进展，确认数据提供的正式审批归属、复购率与活跃会员口径由谁确定，并核实会员老化判断的依据。",
  "state": "ended",
  "messages": [
    {
      "id": "MSG-02645",
      "speaker": "assistant",
      "content": "又见面了，这次你们想接着问什么？"
    },
    {
      "id": "MSG-02646",
      "speaker": "user",
      "content": "沈总好，这周我们已经跟小林、陈姐、老周、王经理都聊过了。有两件事想请您帮忙理一下归属，先说第一件：会员和订单数据给我们做验证，老周说他可以配合核查、提接入条件，王经理说他负责预算和合同核查，但正式审批两位都说不在自己这里。这个审批一般归谁，或者您看该找谁？"
    },
    {
      "id": "MSG-02647",
      "speaker": "assistant",
      "content": "数据验证这块，系统和数据条件先跟老周核对，预算和合同让王经理参与，这两条没问题。至于正式审批具体归谁，我这边没有能确认的信息，不能替哪个部门拍这个板。\n\n我的做法是把相关方叫到一起，各自说明依据、还缺什么，把审批链条和谁补材料理清楚，再往下走。我的口头期待不能替代部门的专业确认。"
    },
    {
      "id": "MSG-02648",
      "speaker": "user",
      "content": "明白。那把相关方叫到一起这件事，是由您来牵头吗，大概什么时候合适？另外口径也有同样的情况：复购率和活跃会员怎么算，小林、陈姐、老周都说要项目组核实。这个会上能不能一起把口径对清楚，最后由谁来拍板？"
    },
    {
      "id": "MSG-02649",
      "speaker": "assistant",
      "content": "召集相关方这件事由我牵头，我会把几位负责人叫到一起，先听清各自依据和还缺什么。具体时间得跟老周、小林、陈姐他们排，我现在给不了准日子。\n\n口径可以放到这个会上一起对：复购率和活跃会员的业务说法、系统统计分别记下来，明确下一步谁补材料、一起核对。但最后不是由我拍板说哪个算法或哪个人数已经核实，口径仍要项目组和相关同事核实。复购率连续四个季度下滑这个判断，具体计算口径也要这样核。"
    },
    {
      "id": "MSG-02652",
      "speaker": "user",
      "content": "最后想问问会员老化。您当时觉得会员老化比较明显，主要是从哪些情况看出来的？这周跟小林、陈姐聊，她们手上都还没有能直接证实的材料，所以想听听您最初的依据。"
    },
    {
      "id": "MSG-02653",
      "speaker": "assistant",
      "content": "会员老化是我目前对复购下滑原因的判断，不是核实过的年龄结构变化或因果结论。我们按 80 万活跃会员来看，具体口径还得跟相关同事核实。我手上没有能直接支撑这个判断的核验材料，你们把它列为待验证的问题就行。临时拿个顾客故事来当证据，我不会认。"
    },
    {
      "id": "MSG-02656",
      "speaker": "user",
      "content": "谢谢沈总，我复述一下：数据验证这块，系统和数据条件找老周核对，预算和合同由王经理参与；正式审批归谁，您这边没有能确认的信息，不替部门拍板。您会牵头把几位负责人叫到一起，各自说明依据和还缺什么，把审批链条和谁补材料理清楚，具体时间要跟老周、小林、陈姐排。\n\n口径也放到这个会上对：复购率和活跃会员的业务说法和系统统计分别记下来，明确谁补材料、一起核对。最后不是由您拍板，口径要项目组和相关同事核实，复购率连续四个季度下滑的计算口径也一样。\n\n会员老化是您目前对原因的判断，不是核实过的结论，手上没有直接支撑的材料，我们列为待验证的问题；临时找来的顾客故事不能当证据。有理解不对的地方请您指正。"
    },
    {
      "id": "MSG-02657",
      "speaker": "assistant",
      "content": "复述得基本准确，没有要纠正的地方。我再收一句：相关方由我召集，先各自说明依据、还缺什么，再定谁补材料、一起核对。正式审批具体归谁，我这边没有能确认的信息，不替哪个部门拍板；复购率和活跃会员的口径仍要项目组和相关同事核实，把业务说法和系统统计分别记下来。会员老化还是待验证的判断，我手上没有能直接支撑的材料。"
    }
  ]
}